{
  "schema_version": "1.0.0",
  "corpus_digest": "0121eaf814f7bd26b08da98fc6c60ae950467b53752821fce704dc46860c4ec1",
  "query": "approved help",
  "topic_kind": "help",
  "results": [
    {
      "topic_id": "approved-help",
      "topic_version": "1.0.0",
      "topic_kind": "help",
      "title": "Find approved help",
      "summary": "Browse reviewed platform explanations without replacing their canonical sources.",
      "glossary_term": "approved help",
      "topic_digest": "dd527cbfa6bfd8fe6e62e26d2cbe286ca226762c1a50e201a63b0da016a6df65"
    }
  ],
  "next_cursor": null
}
